{
  "schemaVersion": 1,
  "description": "Maps Claude OS scripts, skills, manifests, gates, shell templates, and policies into maturity-tiered components. strict/release surfaces must not resolve to experimental (or deprecated) components unless allowlisted.",
  "strictReleaseExperimentalAllowlist": {
    "toolIds": [],
    "componentIds": []
  },
  "components": [
    {
      "id": "core-orchestration",
      "title": "Release-path orchestration and primary contracts",
      "maturity": "core",
      "members": [
        {
          "kind": "tool",
          "id": "os-validate"
        },
        {
          "kind": "tool",
          "id": "os-validate-all"
        },
        {
          "kind": "tool",
          "id": "verify-os-health"
        },
        {
          "kind": "tool",
          "id": "verify-script-manifest"
        },
        {
          "kind": "tool",
          "id": "verify-json-contracts"
        },
        {
          "kind": "tool",
          "id": "verify-deprecations"
        },
        {
          "kind": "tool",
          "id": "verify-quality-gates"
        },
        {
          "kind": "tool",
          "id": "verify-runtime-budget"
        },
        {
          "kind": "tool",
          "id": "verify-context-economy"
        },
        {
          "kind": "tool",
          "id": "verify-doc-contract-consistency"
        },
        {
          "kind": "manifest",
          "path": "bootstrap-manifest.json"
        },
        {
          "kind": "manifest",
          "path": "capability-manifest.json"
        },
        {
          "kind": "manifest",
          "path": "component-manifest.json"
        },
        {
          "kind": "manifest",
          "path": "deprecation-manifest.json"
        },
        {
          "kind": "manifest",
          "path": "os-manifest.json"
        },
        {
          "kind": "manifest",
          "path": "script-manifest.json"
        },
        {
          "kind": "manifest",
          "path": "skills-manifest.json"
        }
      ]
    },
    {
      "id": "stable-delivery",
      "title": "Validators, operators, mutations, and secondary manifests",
      "maturity": "stable",
      "members": [
        {
          "kind": "tool",
          "id": "build-distribution"
        },
        {
          "kind": "tool",
          "id": "evaluate-quality-gate"
        },
        {
          "kind": "tool",
          "id": "export-audit-evidence"
        },
        {
          "kind": "tool",
          "id": "git-recover-local"
        },
        {
          "kind": "tool",
          "id": "init-os-runtime"
        },
        {
          "kind": "tool",
          "id": "invoke-safe-apply"
        },
        {
          "kind": "tool",
          "id": "os-doctor"
        },
        {
          "kind": "tool",
          "id": "os-runtime"
        },
        {
          "kind": "tool",
          "id": "os-update-project"
        },
        {
          "kind": "tool",
          "id": "query-docs-index"
        },
        {
          "kind": "tool",
          "id": "route-capability"
        },
        {
          "kind": "tool",
          "id": "run-contract-tests"
        },
        {
          "kind": "tool",
          "id": "runtime-profile"
        },
        {
          "kind": "tool",
          "id": "session-absorb"
        },
        {
          "kind": "tool",
          "id": "session-digest"
        },
        {
          "kind": "tool",
          "id": "session-prime"
        },
        {
          "kind": "tool",
          "id": "sync-agent-adapters"
        },
        {
          "kind": "tool",
          "id": "sync-skills"
        },
        {
          "kind": "tool",
          "id": "test-skills"
        },
        {
          "kind": "tool",
          "id": "verify-agent-adapter-drift"
        },
        {
          "kind": "tool",
          "id": "verify-agent-adapters"
        },
        {
          "kind": "tool",
          "id": "append-approval-log"
        },
        {
          "kind": "tool",
          "id": "verify-approval-log"
        },
        {
          "kind": "tool",
          "id": "verify-bootstrap-examples"
        },
        {
          "kind": "tool",
          "id": "verify-bootstrap-manifest"
        },
        {
          "kind": "tool",
          "id": "verify-lifecycle"
        },
        {
          "kind": "tool",
          "id": "verify-capabilities"
        },
        {
          "kind": "tool",
          "id": "verify-checklists"
        },
        {
          "kind": "tool",
          "id": "verify-components"
        },
        {
          "kind": "tool",
          "id": "verify-compatibility"
        },
        {
          "kind": "tool",
          "id": "verify-claudeignore"
        },
        {
          "kind": "tool",
          "id": "verify-critical-systems"
        },
        {
          "kind": "tool",
          "id": "verify-distribution"
        },
        {
          "kind": "tool",
          "id": "verify-doc-manifest"
        },
        {
          "kind": "tool",
          "id": "verify-docs-index"
        },
        {
          "kind": "tool",
          "id": "verify-examples"
        },
        {
          "kind": "tool",
          "id": "verify-git-hygiene"
        },
        {
          "kind": "tool",
          "id": "verify-no-secrets"
        },
        {
          "kind": "tool",
          "id": "verify-os-invariants"
        },
        {
          "kind": "tool",
          "id": "verify-playbooks"
        },
        {
          "kind": "tool",
          "id": "verify-recipes"
        },
        {
          "kind": "tool",
          "id": "verify-runtime-dispatcher"
        },
        {
          "kind": "tool",
          "id": "verify-runtime-profiles"
        },
        {
          "kind": "tool",
          "id": "verify-runtime-release"
        },
        {
          "kind": "tool",
          "id": "verify-security-policy"
        },
        {
          "kind": "tool",
          "id": "verify-session-memory"
        },
        {
          "kind": "tool",
          "id": "verify-skills"
        },
        {
          "kind": "tool",
          "id": "verify-skills-drift"
        },
        {
          "kind": "tool",
          "id": "verify-skills-economy"
        },
        {
          "kind": "tool",
          "id": "verify-skills-manifest"
        },
        {
          "kind": "tool",
          "id": "verify-skills-structure"
        },
        {
          "kind": "tool",
          "id": "verify-token-economy-policy"
        },
        {
          "kind": "tool",
          "id": "verify-upgrade-notes"
        },
        {
          "kind": "tool",
          "id": "verify-workflow-manifest"
        },
        {
          "kind": "tool",
          "id": "workflow-status"
        },
        {
          "kind": "tool",
          "id": "write-validation-history"
        },
        {
          "kind": "skill",
          "id": "adapter-drift"
        },
        {
          "kind": "skill",
          "id": "bootstrap-governance"
        },
        {
          "kind": "skill",
          "id": "doc-contract-audit"
        },
        {
          "kind": "skill",
          "id": "epistemic-discipline"
        },
        {
          "kind": "skill",
          "id": "incident-safe-change"
        },
        {
          "kind": "skill",
          "id": "invariant-engineering"
        },
        {
          "kind": "skill",
          "id": "multi-agent-coordination"
        },
        {
          "kind": "skill",
          "id": "production-safety"
        },
        {
          "kind": "skill",
          "id": "release-readiness"
        },
        {
          "kind": "skill",
          "id": "runtime-economy"
        },
        {
          "kind": "skill",
          "id": "token-economy"
        },
        {
          "kind": "skill",
          "id": "approval-ledger"
        },
        {
          "kind": "skill",
          "id": "bootstrap-auditor"
        },
        {
          "kind": "skill",
          "id": "compatibility-auditor"
        },
        {
          "kind": "skill",
          "id": "component-maturity"
        },
        {
          "kind": "skill",
          "id": "contract-testing"
        },
        {
          "kind": "skill",
          "id": "deprecation-manager"
        },
        {
          "kind": "skill",
          "id": "distribution-builder"
        },
        {
          "kind": "skill",
          "id": "evidence-export"
        },
        {
          "kind": "skill",
          "id": "lifecycle-manager"
        },
        {
          "kind": "skill",
          "id": "operator-journal"
        },
        {
          "kind": "skill",
          "id": "quality-gate-evaluator"
        },
        {
          "kind": "skill",
          "id": "safe-apply"
        },
        {
          "kind": "skill",
          "id": "security-lint"
        },
        {
          "kind": "skill",
          "id": "session-memory-auditor"
        },
        {
          "kind": "skill",
          "id": "upgrade-planner"
        },
        {
          "kind": "playbook",
          "id": "adapter-drift-repair"
        },
        {
          "kind": "playbook",
          "id": "bootstrap-project"
        },
        {
          "kind": "playbook",
          "id": "docs-contract-audit"
        },
        {
          "kind": "playbook",
          "id": "incident"
        },
        {
          "kind": "playbook",
          "id": "migration"
        },
        {
          "kind": "playbook",
          "id": "release"
        },
        {
          "kind": "policy",
          "path": "policies/deprecation.md"
        },
        {
          "kind": "policy",
          "path": "policies/engineering-governance.md"
        },
        {
          "kind": "policy",
          "path": "policies/model-selection.md"
        },
        {
          "kind": "policy",